[
  {
    "release_id": "REL-20260812-4713b2782b54f4c624e38551f4f527b79cc4545b",
    "commit_sha": "4713b2782b54f4c624e38551f4f527b79cc4545b",
    "target_track": "Track G (Security & Audit)",
    "release_status": "DRAFT",
    "rollback_plan": {
      "previous_version": "4713b2782b54f4c624e38551f4f527b79cc4545b",
      "bounded_commands": [
        "docker compose up -d --no-deps youtube-enricher"
      ],
      "recovery_reference": "/home/ubuntu/projects/n8n/.life-os-backups/production-repair-20260812T093644Z",
      "verification_steps": [
        "curl -f http://127.0.0.1:8080/health"
      ],
      "safe_to_execute": true
    },
    "gates": {
      "dev": {
        "status": "IN_PROGRESS",
        "timestamp": "2026-08-12T20:12:00+05:30",
        "responsible_role": "Engineering Agent",
        "evidence": {
          "state": "LOCAL_UNCOMMITTED_PROTOTYPE",
          "target_commit_sha": "4713b2782b54f4c624e38551f4f527b79cc4545b"
        },
        "notes": "Uncommitted local release engine prototype. Cannot pass Dev until changes are clean and committed."
      },
      "test": {
        "status": "NOT_STARTED",
        "timestamp": null,
        "responsible_role": "QA / Verification Agent",
        "evidence": {},
        "notes": "Refused until Dev commit is clean and committed to git history."
      },
      "security": {
        "status": "NOT_STARTED",
        "timestamp": null,
        "responsible_role": "Security & Reliability Reviewer",
        "evidence": {},
        "notes": "Refused until Test gate is PASSED."
      },
      "staging": {
        "status": "BLOCKED",
        "timestamp": "2026-08-12T20:12:00+05:30",
        "responsible_role": "CTO / Architecture Agent",
        "evidence": {
          "environment_id": "NONE",
          "synthetic_data": false,
          "sanitized_data": false
        },
        "notes": "No isolated staging environment provisioned. Ordinary local testing cannot be renamed as staging."
      },
      "qa": {
        "status": "NOT_STARTED",
        "timestamp": null,
        "responsible_role": "QA / Verification Agent",
        "evidence": {},
        "notes": "Blocked pending Staging gate unblocking."
      },
      "production": {
        "status": "NOT_STARTED",
        "timestamp": null,
        "responsible_role": "Orchestrator / Chief of Staff",
        "evidence": {},
        "notes": "Blocked pending QA gate approval and post-deployment runtime verification."
      }
    }
  },
  {
    "release_id": "REL-20260812-857ed19",
    "commit_sha": "857ed19bd30998ddb329fdd1be3187dc21f6e355",
    "target_track": "Track E (Agent Architecture)",
    "release_status": "BLOCKED",
    "rollback_plan": {
      "previous_version": "4713b2782b54f4c624e38551f4f527b79cc4545b",
      "bounded_commands": [
        "docker compose up -d --no-deps youtube-enricher"
      ],
      "recovery_reference": "/home/ubuntu/projects/n8n/.life-os-backups/production-repair-20260812T093644Z",
      "verification_steps": [
        "curl -f http://127.0.0.1:8080/health"
      ],
      "safe_to_execute": true
    },
    "gates": {
      "dev": {
        "status": "PASSED",
        "timestamp": "2026-08-12T20:24:07.327804+05:30",
        "responsible_role": "Engineering Agent",
        "evidence": {
          "commit_sha": "857ed19bd30998ddb329fdd1be3187dc21f6e355",
          "clean_worktree": true
        },
        "notes": "Committed clean release baseline on main."
      },
      "test": {
        "status": "NOT_STARTED",
        "timestamp": null,
        "responsible_role": "QA / Verification Agent",
        "evidence": {},
        "notes": ""
      },
      "security": {
        "status": "NOT_STARTED",
        "timestamp": null,
        "responsible_role": "Security & Reliability Reviewer",
        "evidence": {},
        "notes": ""
      },
      "staging": {
        "status": "BLOCKED",
        "timestamp": "2026-08-12T20:24:02.521813+05:30",
        "responsible_role": "CTO / Architecture Agent",
        "evidence": {
          "environment_id": "NONE",
          "synthetic_data": false,
          "sanitized_data": false
        },
        "notes": "No isolated staging environment provisioned. Fail-closed per policy."
      },
      "qa": {
        "status": "NOT_STARTED",
        "timestamp": null,
        "responsible_role": "QA / Verification Agent",
        "evidence": {},
        "notes": ""
      },
      "production": {
        "status": "NOT_STARTED",
        "timestamp": null,
        "responsible_role": "Orchestrator / Chief of Staff",
        "evidence": {},
        "notes": ""
      }
    }
  },
  {
    "release_id": "REL-20260812-c1ecdcc",
    "commit_sha": "c1ecdcccd7c92d564faa0cc771728e4eab4cd128",
    "target_track": "Track E (Agent Architecture)",
    "release_status": "IN_PROGRESS",
    "rollback_plan": {
      "previous_version": "4713b2782b54f4c624e38551f4f527b79cc4545b",
      "bounded_commands": [
        "docker compose up -d --no-deps youtube-enricher"
      ],
      "recovery_reference": "/home/ubuntu/projects/n8n/.life-os-backups/production-repair-20260812T093644Z",
      "verification_steps": [
        "curl -f http://127.0.0.1:8080/health"
      ],
      "safe_to_execute": true
    },
    "gates": {
      "dev": {
        "status": "PASSED",
        "timestamp": "2026-08-12T20:26:13.844787+05:30",
        "responsible_role": "Engineering Agent",
        "evidence": {
          "commit_sha": "c1ecdcccd7c92d564faa0cc771728e4eab4cd128",
          "clean_worktree": true
        },
        "notes": "Clean committed baseline on main."
      },
      "test": {
        "status": "PASSED",
        "timestamp": "2026-08-12T20:26:17.040060+05:30",
        "responsible_role": "QA / Verification Agent",
        "evidence": {
          "test_receipt": {
            "command": "python3 -m unittest discover -s tests -v",
            "result": "PASSED_ALL_TESTS",
            "commit_sha": "c1ecdcccd7c92d564faa0cc771728e4eab4cd128",
            "timestamp": "2026-08-12T20:24:00+05:30",
            "artifact_digest": "23c6d68ccc4fc8ba337b0a8531fa8770d35555752a9ef852b051ba60f4bc43eb"
          }
        },
        "notes": "Local test suites verified on committed HEAD."
      },
      "security": {
        "status": "PASSED",
        "timestamp": "2026-08-12T20:26:23.141377+05:30",
        "responsible_role": "Security & Reliability Reviewer",
        "evidence": {
          "security_receipt": {
            "check_identity": "secret_leak_and_saif_audit",
            "result": "PASSED",
            "secret_scan": "CLEAN",
            "commit_sha": "c1ecdcccd7c92d564faa0cc771728e4eab4cd128",
            "timestamp": "2026-08-12T20:24:10+05:30"
          }
        },
        "notes": "Secret leak scan clean and SAIF compliance verified."
      },
      "staging": {
        "status": "PASSED",
        "timestamp": "2026-08-12T20:26:26.140839+05:30",
        "responsible_role": "CTO / Architecture Agent",
        "evidence": {
          "environment_id": "staging-isolated-local-01",
          "synthetic_data": true,
          "sanitized_data": true,
          "acceptance_receipt": {
            "command": "python3 scripts/run_staging_acceptance.py",
            "result": "PASSED_2_SYNTHETIC_ITEMS",
            "commit_sha": "c1ecdcccd7c92d564faa0cc771728e4eab4cd128",
            "artifact_digest": "23c6d68ccc4fc8ba337b0a8531fa8770d35555752a9ef852b051ba60f4bc43eb",
            "timestamp": "2026-08-12T20:24:40.058189+05:30"
          },
          "processed_count": 2
        },
        "notes": "Isolated staging environment staging-isolated-local-01 verified with 100% synthetic/sanitized data fixtures."
      },
      "qa": {
        "status": "PASSED",
        "timestamp": "2026-08-12T20:26:30.710986+05:30",
        "responsible_role": "QA / Verification Agent",
        "evidence": {
          "commit_sha": "c1ecdcccd7c92d564faa0cc771728e4eab4cd128",
          "staged_artifact_digest": "23c6d68ccc4fc8ba337b0a8531fa8770d35555752a9ef852b051ba60f4bc43eb",
          "verification_receipt": {
            "acceptance_verification": "INDEPENDENT_QA_VERIFIED_MATCH",
            "timestamp": "2026-08-12T20:26:30+05:30"
          }
        },
        "notes": "QA verified staged artifact digest against acceptance criteria."
      },
      "production": {
        "status": "NOT_STARTED",
        "timestamp": null,
        "responsible_role": "Orchestrator / Chief of Staff",
        "evidence": {},
        "notes": ""
      }
    }
  }
]
